,Index,Emergent Behavior,Train/Test Score
0,000,load-generation balance,-0.09317293206475008
1,004,"north-to-south, red-to-green transition times",0.7256621547123323
2,005,avoid many simultaneous charging cycles,0.3434247968307038
3,007,cost limits are not exceeded,0.11634146670084011
4,010,promote to use a VPP from a new electricity production cost policy,0.3116337665623906
5,011,cluster together into local energy collectives,0.47490563157342547
6,013,peak optimization,0.37323547910983745
7,014,distributed negotiations between groups,0.3412709751462327
8,017,system disruption responses and minimization of  the overall costs of satisfying total demand from the system in these events,0.3573206926109228
9,018,agents perform different functions based on their unique advantages relative to other agents postdisruption,0.7306700055382036
10,019,"coordination mechanism, dynamic reorganization and coordination of the network under a disruption",0.016047572822368128
11,022,supply power power to the electric load,0.3458726103687054
12,023,Different responses according to different demand/response schemes (price-based),0.594881621669325
13,024,decision about the best control design of the Smart Grid,0.6797133161730617
14,025,to proactively plan the DC operation as a system to be able to exploit its latent flexible energy to achieve a deeper and more efficient integration with the local Smart Grid.,0.3704682300139328
15,027,battery storage models,0.6511961439640832
16,028,use storage and demand-response techniques,0.5815676520696069
17,030,deploy batteries in different ways depending on the behaviour of their members,0.6842628495598433
18,031,Optimize the overall charging behavior,0.6132624485046247
19,033,control the battery and enhance the operation of the system,0.4317108995856367
20,034,decrease the power consumption from power utility by using available energy from the solar panels,0.666658688382604
