,Index,Emergent Behavior,Train/Test Score
0,004,"north-to-south, red-to-green transition times",0.5072699080375068
1,009,optimise energy usage in a range of weather conditions,-0.01837631528153505
2,010,promote to use a VPP from a new electricity production cost policy,-0.017137115283753168
3,011,cluster together into local energy collectives,0.2955767011968953
4,012,market mechanisms,0.9319357112354236
5,013,peak optimization,0.4142372701364161
6,016,"to use as much as possible of the locally produced renewable energy and transact energy to decrease operational costs, optimizing its integration in smart grid advanced context.",0.422677908810533
7,017,system disruption responses and minimization of  the overall costs of satisfying total demand from the system in these events,0.28201867072133324
8,018,agents perform different functions based on their unique advantages relative to other agents postdisruption,0.3134527502096398
9,019,"coordination mechanism, dynamic reorganization and coordination of the network under a disruption",0.15389177270927468
10,020,Negotiation and collaboration for resource allocation and demand efficiency,-0.42588353463416384
11,022,supply power power to the electric load,0.2651505026815668
12,023,Different responses according to different demand/response schemes (price-based),0.6104974154060198
13,025,to proactively plan the DC operation as a system to be able to exploit its latent flexible energy to achieve a deeper and more efficient integration with the local Smart Grid.,0.24126904118143844
14,026,energy consumption/production patterns,0.931935657209658
15,028,use storage and demand-response techniques,0.36980156968262057
16,030,deploy batteries in different ways depending on the behaviour of their members,0.8897171397159512
17,032,grid stability,0.5599192504281536
18,034,decrease the power consumption from power utility by using available energy from the solar panels,0.7122006257010891
19,039,improve citizens health,0.8549477138339385
